{
  "contract_version": "1.0.0",
  "demo_clock": {
    "today": "2026-09-01",
    "current_month": "2026-09"
  },
  "household": {
    "id": "83f5b53b-ff04-4c97-983b-fac5bcda2db2",
    "name": "Rivera Household",
    "currency_code": "USD",
    "ai_context_text": "Two-parent US household with one teenager, discretionary spending only (fixed costs are handled outside this budget). The grid tracks each person's monthly allowance per category as whole amounts; a negotiation redistributes allowance between people and always nets to zero, leaving the category and household totals unchanged. Available savings and progress toward a $5,000 goal (target February 1, 2027) are entered by a member at setup and shown as a single number, separate from this grid. September starts at baseline allowances with no negotiations yet, so the propose-and-agree flow can be demonstrated from a clean slate."
  },
  "members": [
    {
      "id": "1eac12a9-723b-4258-b5e4-6c4395062c27",
      "role": "parent_1",
      "display_name": "Parent 1",
      "short_name": "P1",
      "can_propose": true
    },
    {
      "id": "3b33efd4-ed26-45da-b951-0fc84180ea68",
      "role": "parent_2",
      "display_name": "Parent 2",
      "short_name": "P2",
      "can_propose": true
    },
    {
      "id": "6b1a1c9a-946b-4919-8cd8-43bcf8deb9d2",
      "role": "teen_1",
      "display_name": "Teen 1",
      "short_name": "Teen",
      "can_propose": true
    }
  ],
  "categories": [
    {
      "id": "777696bf-0888-4953-b831-ebd117d9df5d",
      "name": "Groceries",
      "sort_order": 1,
      "is_hard_floor": true
    },
    {
      "id": "68abcdaa-8236-4b0b-9bdf-e94eace22997",
      "name": "Dining out & takeout",
      "sort_order": 2,
      "is_hard_floor": false
    },
    {
      "id": "302ff348-f54c-42a4-aaa1-45e09f1fe2fb",
      "name": "Liquor store",
      "sort_order": 3,
      "is_hard_floor": false
    },
    {
      "id": "d53b6769-48af-4bfd-8d3a-8b69bbd5d7f9",
      "name": "Bars & nightlife",
      "sort_order": 4,
      "is_hard_floor": false
    },
    {
      "id": "506a5d51-7b06-45e4-8115-fb9980b2db25",
      "name": "Entertainment & subscriptions",
      "sort_order": 5,
      "is_hard_floor": false
    },
    {
      "id": "27a8ce2f-38c5-4b91-8690-83e17901dd85",
      "name": "Shopping & apparel",
      "sort_order": 6,
      "is_hard_floor": false
    },
    {
      "id": "41216117-07db-44e0-bc39-9aad3f01ba4b",
      "name": "Travel & outings",
      "sort_order": 7,
      "is_hard_floor": false
    }
  ],
  "goal": {
    "id": "da9de6da-95ca-4ad3-a662-9d363d885752",
    "name": "Family savings cushion",
    "target_amount_minor": 500000,
    "target_date": "2027-02-01",
    "saved_amount_minor": 0,
    "plan_months": [
      "2026-09",
      "2026-10",
      "2026-11",
      "2026-12",
      "2027-01"
    ]
  },
  "spend_summaries": [
    {
      "id": "53aa0df8-268b-41f3-8f75-a38d81108fc5",
      "source": "historical_reference",
      "granularity": "month",
      "period_start": "2025-09-01",
      "period_end": "2025-09-30",
      "member_id": "1eac12a9-723b-4258-b5e4-6c4395062c27",
      "category_id": "777696bf-0888-4953-b831-ebd117d9df5d",
      "actual_amount_minor": 78000
    },
    {
      "id": "63abf301-2706-469d-b48c-f80b97d72bd9",
      "source": "historical_reference",
      "granularity": "month",
      "period_start": "2025-10-01",
      "period_end": "2025-10-31",
      "member_id": "1eac12a9-723b-4258-b5e4-6c4395062c27",
      "category_id": "777696bf-0888-4953-b831-ebd117d9df5d",
      "actual_amount_minor": 74000
    },
    {
      "id": "9f638391-b5e4-410c-ac1b-9155bf7f2471",
      "source": "historical_reference",
      "granularity": "month",
      "period_start": "2025-11-01",
      "period_end": "2025-11-30",
      "member_id": "1eac12a9-723b-4258-b5e4-6c4395062c27",
      "category_id": "777696bf-0888-4953-b831-ebd117d9df5d",
      "actual_amount_minor": 82000
    },
    {
      "id": "1f1e41f1-293d-4f7d-ae8b-919ca2fd567d",
      "source": "historical_reference",
      "granularity": "month",
      "period_start": "2025-12-01",
      "period_end": "2025-12-31",
      "member_id": "1eac12a9-723b-4258-b5e4-6c4395062c27",
      "category_id": "777696bf-0888-4953-b831-ebd117d9df5d",
      "actual_amount_minor": 80000
    },
    {
      "id": "41d387b7-52c6-4e05-bd54-9ecb465afd75",
      "source": "historical_reference",
      "granularity": "month",
      "period_start": "2026-01-01",
      "period_end": "2026-01-31",
      "member_id": "1eac12a9-723b-4258-b5e4-6c4395062c27",
      "category_id": "777696bf-0888-4953-b831-ebd117d9df5d",
      "actual_amount_minor": 72000
    },
    {
      "id": "69b6c2e7-ab02-49c5-b72f-66bf7d02e4af",
      "source": "historical_reference",
      "granularity": "month",
      "period_start": "2025-09-01",
      "period_end": "2025-09-30",
      "member_id": "1eac12a9-723b-4258-b5e4-6c4395062c27",
      "category_id": "68abcdaa-8236-4b0b-9bdf-e94eace22997",
      "actual_amount_minor": 28800
    },
    {
      "id": "dc58b4f0-42db-45e1-908f-40bc050d4b99",
      "source": "historical_reference",
      "granularity": "month",
      "period_start": "2025-09-01",
      "period_end": "2025-09-30",
      "member_id": "3b33efd4-ed26-45da-b951-0fc84180ea68",
      "category_id": "68abcdaa-8236-4b0b-9bdf-e94eace22997",
      "actual_amount_minor": 28800
    },
    {
      "id": "e49c6087-ab2e-4640-9dda-6b140ed66451",
      "source": "historical_reference",
      "granularity": "month",
      "period_start": "2025-09-01",
      "period_end": "2025-09-30",
      "member_id": "6b1a1c9a-946b-4919-8cd8-43bcf8deb9d2",
      "category_id": "68abcdaa-8236-4b0b-9bdf-e94eace22997",
      "actual_amount_minor": 14400
    },
    {
      "id": "aab4f9d1-824b-4998-9525-44c3b6f782ce",
      "source": "historical_reference",
      "granularity": "month",
      "period_start": "2025-10-01",
      "period_end": "2025-10-31",
      "member_id": "1eac12a9-723b-4258-b5e4-6c4395062c27",
      "category_id": "68abcdaa-8236-4b0b-9bdf-e94eace22997",
      "actual_amount_minor": 27200
    },
    {
      "id": "64347f9c-1a26-4ee0-bf9b-5a48c19ba2ea",
      "source": "historical_reference",
      "granularity": "month",
      "period_start": "2025-10-01",
      "period_end": "2025-10-31",
      "member_id": "3b33efd4-ed26-45da-b951-0fc84180ea68",
      "category_id": "68abcdaa-8236-4b0b-9bdf-e94eace22997",
      "actual_amount_minor": 27200
    },
    {
      "id": "f10dfc5b-6a9c-40b1-95c7-d59727f5c57d",
      "source": "historical_reference",
      "granularity": "month",
      "period_start": "2025-10-01",
      "period_end": "2025-10-31",
      "member_id": "6b1a1c9a-946b-4919-8cd8-43bcf8deb9d2",
      "category_id": "68abcdaa-8236-4b0b-9bdf-e94eace22997",
      "actual_amount_minor": 13600
    },
    {
      "id": "324d7d99-6610-4dd9-b578-7600bb30f6ae",
      "source": "historical_reference",
      "granularity": "month",
      "period_start": "2025-11-01",
      "period_end": "2025-11-30",
      "member_id": "1eac12a9-723b-4258-b5e4-6c4395062c27",
      "category_id": "68abcdaa-8236-4b0b-9bdf-e94eace22997",
      "actual_amount_minor": 28000
    },
    {
      "id": "e7686b1e-985d-4bf7-ac04-22d3b0d3efa3",
      "source": "historical_reference",
      "granularity": "month",
      "period_start": "2025-11-01",
      "period_end": "2025-11-30",
      "member_id": "3b33efd4-ed26-45da-b951-0fc84180ea68",
      "category_id": "68abcdaa-8236-4b0b-9bdf-e94eace22997",
      "actual_amount_minor": 28000
    },
    {
      "id": "3c23c0bd-662a-4a8b-a912-87c24cf5b6c8",
      "source": "historical_reference",
      "granularity": "month",
      "period_start": "2025-11-01",
      "period_end": "2025-11-30",
      "member_id": "6b1a1c9a-946b-4919-8cd8-43bcf8deb9d2",
      "category_id": "68abcdaa-8236-4b0b-9bdf-e94eace22997",
      "actual_amount_minor": 14000
    },
    {
      "id": "11dedf27-c5a7-4801-a512-ea747a13418b",
      "source": "historical_reference",
      "granularity": "month",
      "period_start": "2025-12-01",
      "period_end": "2025-12-31",
      "member_id": "1eac12a9-723b-4258-b5e4-6c4395062c27",
      "category_id": "68abcdaa-8236-4b0b-9bdf-e94eace22997",
      "actual_amount_minor": 32800
    },
    {
      "id": "10f11820-fee8-4a9f-abfa-a604f219c5a2",
      "source": "historical_reference",
      "granularity": "month",
      "period_start": "2025-12-01",
      "period_end": "2025-12-31",
      "member_id": "3b33efd4-ed26-45da-b951-0fc84180ea68",
      "category_id": "68abcdaa-8236-4b0b-9bdf-e94eace22997",
      "actual_amount_minor": 32800
    },
    {
      "id": "51f34b0c-a57f-4cde-af77-6fe44ac87e80",
      "source": "historical_reference",
      "granularity": "month",
      "period_start": "2025-12-01",
      "period_end": "2025-12-31",
      "member_id": "6b1a1c9a-946b-4919-8cd8-43bcf8deb9d2",
      "category_id": "68abcdaa-8236-4b0b-9bdf-e94eace22997",
      "actual_amount_minor": 16400
    },
    {
      "id": "64be674c-b478-45b7-ab4b-bf7e1396e741",
      "source": "historical_reference",
      "granularity": "month",
      "period_start": "2026-01-01",
      "period_end": "2026-01-31",
      "member_id": "1eac12a9-723b-4258-b5e4-6c4395062c27",
      "category_id": "68abcdaa-8236-4b0b-9bdf-e94eace22997",
      "actual_amount_minor": 24000
    },
    {
      "id": "e88a1682-9fc0-4e90-87b2-bbd4f97b435d",
      "source": "historical_reference",
      "granularity": "month",
      "period_start": "2026-01-01",
      "period_end": "2026-01-31",
      "member_id": "3b33efd4-ed26-45da-b951-0fc84180ea68",
      "category_id": "68abcdaa-8236-4b0b-9bdf-e94eace22997",
      "actual_amount_minor": 24000
    },
    {
      "id": "baec877c-6270-428e-9db9-e0ee7c2788b9",
      "source": "historical_reference",
      "granularity": "month",
      "period_start": "2026-01-01",
      "period_end": "2026-01-31",
      "member_id": "6b1a1c9a-946b-4919-8cd8-43bcf8deb9d2",